"Ad ID","Ad Text","Ad Landing Page","Ad Targeting Location","Excluded Connections","Age","Language","Placements","People Who Match","Friends of Connections","Ad Impressions","Ad Clicks","Ad Spend","Ad Creation Date","Ad End Date"
"3131","You may not have heard of Zelda Wynn Valdes, but you've certainly seen her
designs. This amazing Black fashion designer created the original Playboy
bunny costume.
In 1948, was the first Black designer to open up her own shop on Broadway.
Valdes created gorgeous gowns many stars like Mae West; Joyce Bryant,
Josephine Baker, Gladys Knight, Sarah Vaughan, Dorothy Dandridge, Ella
Fitzgerald and countless others.
Although very little is known about her, Zelda Wynn also created costumes for
the Dance Theater of Harlem and was a founding partner of the National
Association of Fashion and Accessory Designers.
#PanAfricanism #BlackNationalism #BlackEmpowerment
#African Empowerment #AfricanAndProud #BlackAndProud #BlackPride
#BlackPower #BlackLivesMatter #Amerikkka #UnapologeticallyBlack
#UnapologeticallyAfrican #BlacklnAmerica #BlacklsBeautiful #KnowThySelf
#KnowledgeOfSelf #KnowledgeOfSelflsANationaIity
#EconomicEmpowerment #Integration Failed #WhiteLiesMatter #Education
#African Unification #AfricanUnity #BlackLove #JusticeOrElse #ProBlack
#Regrann #blackexcellence #goals","https://www.facebook.com/Woke-Blacks-294234600956431/","- Living In: United States
Interests: Martin Luther King; Jr., African-American Civil Rights Movement
(1954-68), African-American history or Malcolm X","N/A","18 - 65+","N/A","News Feed on desktop computers or News Feed on mobile
devices","N/A","N/A","13,378","1,971","200.00 RUB","02/22/17 05:58:39 AM PST","02/25/17 05:58:39 AM PST"
"3139","Some people's contribution to the Black man's confidence in themselves
cannot be overlooked, Y'all remember Nichelle Nichols, popularly known as
Uhura?
Well Dr. Martin Luther King once pleaded that she reconsider her decision to
quit and stay on StarTrek because her role was so important to the
community.
Do you believe similar sacrifices from Black people in white supremacy
systems could really influence anything for the ordinary Black man?
#PanAfricanism #BlackNationalism #BlackEmpowerment
#African Empowerment #AfricanAndProud #BlackAndProud #BlackPride
#BlackPower #BlackLivesMatter #Amerikkka #UnapologeticallyBlack
#UnapologeticallyAfrican #BlacklnAmerica #BlacklsBeautiful #KnowThySelf
#KnowledgeOfSelf #KnowledgeOfSelflsANationality
#EconomicEmpowerment #Integration Failed #WhiteLiesMatter #Education
#African Unification #AfricanUnity #BlackLove #JusticeOrElse #ProBlack
#Regrann #blackexcellence #goals","https://www.facebook.com/Woke-Blacks-294234600956431/","- Living In: United States
Interests: Martin Luther King, Jr., African-American Civil Rights Movement
(1954-68), African-American history or Malcolm X","N/A","18 - 65+","N/A","News Feed on desktop computers or News Feed on mobile
devices","N/A","N/A","16,597","2,615","300.00 RUB","02/22/17 06:01:04 AM PST","02/25/17 06:01:04 AM PST"
"3298","So lovely girl.","https://www.facebook.com/nativeprideunited/","- Living In: United States","N/A","18 - 65+","N/A","News Feed on desktop computers or News Feed on mobile
devices","Interests: American Indian Movement, Native American
Indian Wisdom, Cherokee language or Cherokee Nation","N/A","2,041","274","200.00 RUB","02/07/17 03:38:24 AM PST","02/08/17 03:38:24 AM PST"
"3146","I see many young Black girls skating and excelling in a field that used to be
predominantly white. In the sense that efforts were really made to prevent
Black people from participating in such sports, back in the days.
But thanks to Debi Thomas and other Black skaters; we changed the game
and on Feb. 8. 1986. Debi became the first Black skater to hold a US national
titles in ladies' single figure scating.
Debi; a physician, became the 1986 World champion, the 1988 Olympic
bronze medalist; and a two-time U.S. national champion.
#PanAfricanism #BlackNationalism #BlackEmpowerment
#African Empowerment #AfricanAndProud #BlackAndProud #BlackPride
#BlackPower #BlackLivesMatter #Amerikkka #UnapologeticallyBlack
#UnapologeticallyAfrican #BlacklnAmerica #BlacklsBeautiful #KnowThySelf
#KnowledgeOfSelf #KnowledgeOfSelflsANationaIity
#EconomicEmpowerment MntegrationFailed #WhiteLiesMatter #Education
#African Unification #AfricanUnity #BlackLove #JusticeOrElse #ProBlack
#Regrann #blackexcellence #goals","https://www.facebook.com/Woke-Blacks-294234600956431/","- Living In: United States
Interests: Martin Luther King, Jr., African-American Civil Rights Movement
(1954-68), African-American history or Malcolm X","N/A","18 - 65+","N/A","News Feed on desktop computers or News Feed on mobile
devices","N/A","N/A","25,363","4,805","600.00 RUB","02/22/17 05:58:23 AM PST","02/25/17 05:58:23 AM PST"
"2769","Heritage not hate. God bless Dixie!","https://www.facebook.com/South-United-1777037362551238/","United States","Exclude people who like South United","18 - 65+","English (UK)or English (US)","News Feed on desktop computers, News Feed on mobile
devices or Right column on desktop computers","Interests: Flags of the Confederate States of America,
Hart of Dixie, Mud & Trucks, Dixie or Redneck Nation
And Must Also Match: Interests: Confederate States of America","N/A","0","0","0","03/09/17 04:41:38 AM PST","N/A"
"3365","Join the event, bring your friends, feel safe with us!
It's free! Organized on a donation basis.
Come and train with us
https://www.meetup.com/Black-Fist-Self-Defense-Project/ Free Self-defense
class in NY","https://www.meetup.com/Black-Fist-Self-Defense-Project/","- Living In: United States: New York (+25 mi) New York","N/A","18 - 65+","English (UK) or English (US)","News Feed on desktop computers or News Feed on mobile
devices","Interests: Martin Luther King, Jr., Pan-Africanism, Black
Power, Martial arts, African American, Black history, Black Panther Party,
African-American culture, African-American Civil Rights Movement (1954--68),
Black History Month, African-American history, Angela Davis, Malcolm X, Self
Defense Family, Black (Color) or The Self Defense Company
And Must Also Match: Interests: Mixed martial arts, Martial arts, The Women's
Self Defense Institute, PERSONAL & HOME DEFENSE, Self-defense, Self-
defense (United States), Personal Defense, Right of self-defense, Self
Defense Family or Active Self Protection","N/A","3,483","103","1,326.59 RUB","03/22/17 05:23:10 AM PDT","03/29/17 05:23:10 AM PDT"
"3375","The second self-defense class
your friends, feel safe with us!!! Self-defense classes","https://www.facebook.com/events/694209204073106/","United States: New York (+25 mi) New York","N/A","18 - 65+","English (UK) or English (US)","News Feed on desktop computers or News Feed on mobile
devices","Interests: African-American culture, African-American
Civil Rights Movement ( 1954-68), African-American history or Malcolm X
And Must Also Match: Interests: Mixed martial arts, Martial arts, The Women's
Self Defense Institute, PERSONAL & HOME DEFENSE, Self-defense, Self-
defense (United States), Personal Defense, Right of self-defense, Self
Defense Family or Active Self Protection","N/A","116","5","117.01 RUB","02/07/17 12:05:39 AM PST","02/11/17 03:29:15 PM PST"
"3159","Welcome to the future.
I'm very proud of all our Black youth out there making a difference by getting
knowledge. The future is bright and our liberation is certain, just stay woke to
the system and don't get drowned in it's deceit.
""We cannot always build the future for our youth, but we can build our youth
for the future"" - Franklin D. Roosevelt
#melaninqueen #dope #beautiful #wakeup #wewillsurvive #organize
#westandtogether #blacklivesmatter #unite4justice #black #melanin
#blackisbeautiful #blacklivesmatter #blackgirlmagic #USA #blackandproud
#democrat #republican #Africanamerican #unite4justice #breakingnews
#goals #woke","https://www.facebook.com/Woke-Blacks-294234600956431/","- Living In: United States
Interests: Martin Luther King, Jr., African-American culture, African-American
Civil Rights Movement(1954-68), African-American history, Black
Consciousness Movement or Malcolm X","N/A","18 - 65+","N/A","News Feed on desktop computers or News Feed on mobile
devices","N/A","N/A","6,678","978","200.00 RUB","01/11/17 07:15:18 AM PST","01/12/17 07:15:18 AM PST"
"2885","Together we are a shining beacon of faithfulness! Join us and light your way
to Jesus! Army Of Jesus","https://www.facebook.com/Army-of-Jesus-I195795607160174/","- Living In: United States","N/A","18 - 65+","N/A","News Feed on desktop computers, News Feed on mobile
devices or Right column on desktop computers","Interests: jesus love u, I Am a Child of God, Jesus Daily,
Knowing Jesus or I Have Decided to Follow Jesus
And Must Also Match: Interests: Jesus","N/A","368,065","28,137","89,081.11 RUB","02/20/17 05:37:42 AM PST","N/A"
"2277","A Sense Of Priorities","https://www.facebook.com/blackmattersus.mvmnt/","- Living In: United States","N/A","18 - 65+","N/A","News Feed on desktop computers or News Feed on mobile
devices","Interests: Martin Luther King, Jr.; African-American Civil
Rights Movement (1954-68), African-American history or Malcolm X","N/A","17,566","2,106","583.93 RUB","02/27/17 11:49:37 PM PST","02/28/17 11:49:37 PM PST"
"1043","A 21-year-old senior at the university, Aja Sims, influenced floor routine by
putting Hip-Hop in gymnastics and was praised as #BlackGirlsMagic.
However, several non-black fans took offense to the proclamation. A 21-year-
old senior at the university, Aja Sims, influenced f...","https://www.facebook.com/Blacktivist-128371547505950/","United States","N/A","16 - 65+","English (UK)or English (US)","News Feed on desktop computers or News Feed on mobile
devices","Interests: Pan-Africanism, African-American Civil Rights
Movement(1954-68), African-American history or Black (Color)","N/A","160,565","16,132","600.00 RUB","02/03/17 05:39:22 AM PST","02/04/17 05:39:22 AM PST"
"3371","Self-Defense Project. Feel safe with us.","https://www.facebook.com/Black-Fist-966468950153780/","United States","Exclude people who like Fit Black","18 - 65+","English (UK) or English (US)","News Feed on desktop computers, News Feed on mobile
devices or Right column on desktop computers","Interests: Martin Luther King, Jr., African-American
culture, African-American Civil Rights Movement (1954-68), African-American
history or Malcolm X
And Must Also Match: Interests: The Women's Self Defense Institute, Self-
defense, Personal Defense, Right of self-defense or Active Self Protection","N/A","5,884","476","2,172.11 RUB","02/10/17 05:00:19 AM PST","N/A"
"3321","Join the event, bring your friends, feel safe with us!
Don't miss the opportunity to train with our coach! You will enjoy it for sure.
It's free! Organized on a donation basis. https://www.meetup.com/Black-Fist-
Self-Defense-ProjecU Free Self-Defense class in Tampa , Fl
meetup.com","https://www.meetup.com/Black-Fist-Self-Defense-Project/","- Living In: United States: Tampa (+25 mi) Florida","N/A","18 - 65+","English (UK) or English (US)","News Feed on desktop computers or News Feed on mobile
devices","Interests: Mixed martial arts, Martial arts, The Women's
Self Defense Institute, PERSONAL & HOME DEFENSE, Self-defense, Self-
defense (United States), Personal Defense, Right of self-defense, Self
Defense Family or Active Self Protection
And Must Also Match: Interests: Martin Luther King, Jr., Pan-Africanism,
Black Power, African American, Black history, Black Panther Party, African-
American culture, African-American Civil Rights Movement (1954-68), Black
History Month, African-American history, Angela Davis, Malcolm X or Black
(Color)","N/A","0","0","0","03/28/17 06:30:59 AM PDT","03/29/17 06:31:17 AM PDT"
"3386","Revealing the uncomfortable truth and exposing the liberal media bias! Let's
get red pilled!","https://www.facebook.com/The-Red-Pi11-362365657452374/","United States","Exclude people who like The Red Pill","15 - 40","English (US)","News Feed on desktop computers, lnstagram Feed or News
Feed on mobile devices","Interests: Far-right politics, breitbart, Right-wing politics or
Politics, Politics: Likely to engage with political content (conservative)
And Must Also Match: Interests: Meme","N/A","0","0","0","02/07/17 05:39:53 AM PST","N/A"
"3356","The first self-defense class                             Join the event, bring your
friends, feel safe with us!!! Self-defense classes","https://www.facebook.com/events/180754319075270/","- Living In: United States: Orlando (+50 mi) Florida","N/A","18 - 65+","N/A","News Feed on desktop computers or News Feed on mobile
devices","Interests: The Women's Self Defense Institute, African-
American culture, African-American Civil Rights Movement (1954-68), African-
American history, Right of self-defense or Malcolm X","N/A","0","0","0","02/06/17 05:40:00 AM PST","02/11/17 08:00:00 AM PST"
"3287","Keep fighting for our motherland!","https://www.facebook.com/Native-Americans-United-386046198404902/","- Living In: United States","N/A","18 - 65+","N/A","News Feed on desktop computers or News Feed on mobile
devices","Interests: American Indian Movement, Native American
Indian Wisdom, Cherokee language or Cherokee Nation","N/A","1,421","181","200.00 RUB","02/06/17 05:18:21 AM PST","02/07/17 05:18:21 AM PST"
"2700","People really need to understand","https://www.facebook.com/brownunitedfront/","- Living In: United States","N/A","18 - 65+","N/A","News Feed on desktop computers or News Feed on mobile
devices","Interests: Mexico. Latin hip hop, Chicano Movement,.
Hispanidad, Lowrider, Chicano rap or La Raza","N/A","283","48","10.60 RUB","01/27/17 12:32:54 AM PST","01/29/17 12:32:54 AM PST"
"2855","WOW! He didn't let his vitiligo stop him!
Repost","https://www.facebook.com/PanAfrootsmove/","- Living In: United States","Exclude people who like Pan-African roots MOVE","18 - 65+","English (UK) or English (US)","News Feed on desktop computers or News Feed on mobile
devices","Interests: Martin Luther King, Jr., Black history, African-
American culture, African-American Civil Rights Movement (1954-68), African-
American history, Malcolm X or Black (Color)","N/A","0","0","0","03/28/17 12:43:01 AM PDT","03/29/17 12:43:01 AM PDT"
"2727","Real Mexican-American pride. Respect!
FYI: The three largest Hispanic groups in the United States are the Mexican-
Americans, Puerto Ricans and Cubans.","https://www.facebook.com/brownunitedfront/","- Living In: United States","N/A","18 - 65+","N/A","News Feed on desktop computers or News Feed on mobile
devices","Interests: Hispanic and latino american culture, Mexico,
Mexican american culture, Hispanic culture, Latino culture, Latin hip hop,
Chicano, Chicano Movement, Hispanidad, Mexican Pride, Lowrider, Chicano
rap or La Raza","N/A","82,748","11,051","440.00 RUB","02/16/17 12:42:01 AM PST","02/18/17 12:42:01 AM PST"
"3214","Supporting and developing blk-owned Businesses is the key to raising our
community! Black4Black","https://www.facebook.com/Black4Black-1268698556482143/","- Living In: United States","Exclude people who like Black4Black","18 - 65+","English (UK)or English (US)","News Feed on desktop computers, News Feed on mobile
devices or Right column on desktop computers","Interests: Martin Luther King, Jr., African-American Civil
Rights Movement (1954-68), Black History Month, African-American history
or Black Enterprise
And Must Also Match: Interests: Black Economic Empowerment, Our World
with Black Enterprise, Black Enterprise or Black Enterprise Business Report
Interest expansion: On","N/A","1,379","75","572.64 RUB","02/02/17 07:12:19 AM PST","N/A"
"2661","This costume is dreamy... so much reminds me of a stained glass spiral
window!","https://www.facebook.com/brownunitedfront/","- Living In: United States","N/A","18 - 65+","N/A","News Feed on desktop computers or News Feed on mobile
devices","Interests: Hispanic and latino american culture, Mexico,
Mexican american culture, Hispanic culture, Latino culture, Latin hip hop,
Chicano, Chicano Movement, Hispanidad, Mexican Pride, Lowrider, Chicano
rap or La Raza","N/A","12,341","1,623","400.00 RUB","03/22/17 08:04:58 AM PDT","03/23/17 01:13:00 PM PDT"
"3223","Black Millenials are driving social change and leading digital advancement.
News Much Ado About Black Millenials 2017-01-092017-01-09 0 Comment
Black Millenials Black Millenials are driving social change and leading digital
advancement. The big question in the business world is how to retain top
millennial talent. One in three American workers are between the ages of 20
an... Much Ado About Black Millenials — Black4Black black4black.info","http://black4black.info/2017/01/09/much-ado-about-black-millenials/","- Living In: United States
Interests: Martin Luther King, Jr., African-American Civil Rights Movement
(1954-68), African-American history or Malcolm X","N/A","18 - 65+","N/A","News Feed on desktop computers, Instagram Feed or News
Feed on mobile devices","N/A","N/A","2,757","116","500.00 RUB","01/10/17 06:15:46 AM PST","01/11/17 06:15:46 AM PST"
"944","Black beauty in all shades.","https://www.facebook.com/blacktivists/","United States","N/A","16 - 65+","English (UK) or English (US)","News Feed on desktop computers or News Feed on mobile
devices","Interests: Black nationalism, Pan-Africanism, Police
misconduct, African-American culture, African-American Civil Rights
Movement ( 1954-68), African-American history, Black Consciousness
Movement, Martin Luther King Ill, Stop Police Brutality or Black (Color)","N/A","9,022","1,363","67.64 RUB","03/16/17 05:34:24 AM PDT","03/17/17 01:00:00 PM PDT"
"3048","IT HAS TO GO VIRAL!","https://www.facebook.com/WiIIiamsandKalvin/","- Living In: United States","N/A","18 - 65+","N/A","News Feed on desktop computers or News Feed on mobile
devices","Interests: Martin Luther King, Jr.. Stop Racism!!. African-
American culture. African-American Civil Rights Movement (1954-68), African-
American history, Say To No Racism or Malcolm X","N/A","43,230","6,609","500.00 RUB","02/03/17 03:57:55 AM PST","02/06/17 03:58:23 AM PST"
"2874","It's so unique and inventive. I guess, we can expect white girls trying to wear
this pretty soon.","https://www.facebook.com/PanAfrootsmove/","- Living In: United States","Exclude people who like Pan-African roots MOVE","18 - 65+","English (UK)or English (US)","News Feed on desktop computers or News Feed on mobile
devices","Interests: Martin Luther King, Jr., Black history, African-
American Civil Rights Movement(1954-68), African-American history,
Malcolm X or Black (Color)","N/A","0","0","None","03/14/17 07:47:26 AM PDT","03/17/17 06:00:00 PM PDT"
"2475","Probably you remember Virginia McLaurin who visited the Obamas at the
White House last year. She was 106-year-old at that moment. Later she
celebrated her 107th birthday with the Harlem Globetrotters basketball team.
It seems that Virginia and the team became friends because they celebrated
her 108th birthday together! Virginia McLaurin celebrates 108th birthday with
Harlem Globet...","https://www.facebook.com/iloveblackexcellence/","- Living In: United States","N/A","18 - 65+","N/A","News Feed on desktop computers or News Feed on mobile
devices","Interests: Martin Luther King, Jr., My Black is Beautiful,
Black is beautiful or Black Girls Rock!","N/A","4,450","299","400.00 RUB","03/16/17 07:25:17 AM PDT","03/17/17 07:25:17 AM PDT"
"1137","When ballet dancers can mix modern dance and ballet. When ballet dancers
can mix modern dance and ballet.","https://www.facebook.com/Blacktivist-128371547505950/","United States","N/A","16 - 65+","English (UK) or English (US)","News Feed on desktop computers or News Feed on mobile
devices","Interests: Black nationalism, Pan-Africanism, Police
misconduct, African-American culture, African-American Civil Rights
Movement ( 1954-68), African-American history, Black Consciousness
Movement, Martin Luther King Ill, Stop Police Brutality or Black (Color)","N/A","0","0","0","02/09/17 11:32:25 PM PST","02/11/17 03:48:08 AM PST"
"2709","Make America Aztlan again!","https://www.facebook.com/brownunitedfront/","- Living In: United States","N/A","18 - 65+","N/A","News Feed on desktop computers or News Feed on mobile
devices","Interests: Mexico. Latin hip hop. Chicano Movement,.
Hispanidad, Lowrider, Chicano rap or La Raza","N/A","51,837","7,367","500.00 RUB","02/08/17 11:58:58 PM PST","02/09/17 11:58:58 PM PST"
"2701","This movie never gets old","https://www.facebook.com/brownunitedfront/","- Living In: United States","N/A","18 - 65+","N/A","News Feed on desktop computers or News Feed on mobile
devices","Interests: Mexico. Latin hip hop. Chicano Movement,.
Hispanidad, Lowrider, Chicano rap or La Raza","N/A","119,800","16,760","500.00 RUB","03/13/17 08:05:34 AM PDT","03/15/17 12:00:00 PM PDT"
"2862","It's a very strong photo. Powerful and sad at the same time. This Queen
managed to stay alive and beautiful despite what happened to her. She's
really an example to everyone. GUYS, LETS MAKE HER VIRAL!","https://www.facebook.com/Pan-African-roots-MOVE-265201130527872/","- Living In: United States","Exclude people who like Pan-African roots MOVE","18 - 65+","English (UK)or English (US)","News Feed on desktop computers or News Feed on mobile
devices","Interests: Martin Luther King, Jr., Black history, African-
American culture, African-American Civil Rights Movement(1954-68), African-
American history, Malcolm X or Black (Color)","N/A","1,604","258","300.00 RUB","02/01/17 04:45:42 AM PST","02/02/17 04:45:42 AM PST"
"2961","The community of 2nd Amendment supporters, guns lovers & patriots","https://www.facebook.com/savethe2a/
AdTargetingCustomAudience:Lookalike(US,1%)-PeoplewholikeDefendthe2nd
Location:UnitedStates","N/A","Exclude people who like Defend the 2nd","18 - 65+","English (UK)or English (US)","News Feed on desktop computers, News Feed on mobile
devices or Right column on desktop computers","Interests: Gun Owners of America
And Must Also Match: Interests: Second Amendment to the United States
Constitution","N/A","18,454","1,079","3,516.22 RUB","02/16/17 04:44:53 AM PST","N/A"
"3391","Support our Veterans! Veterans Come First","https://www.facebook.comNeterans-Come-First-I757336424535312/","- Living In: United States","Exclude people who like Veterans Come First","18 - 65+
Gender: Male","N/A","News Feed on desktop computers, News Feed on mobile
devices or Right column on desktop computers","Industry: Veterans (US), Home Composition: Veterans in
home
And Must Also Match: Interests: Vietnam Veterans Memorial, vietnam
veterans america, Vietnam Veterans of America Foundation, US Military
Veterans, Vietnam Veterans of America, Vietnam Veterans Against the War,
Vietnam Veterans Memorial Fund, Disabled American Veterans or Institute for
Veterans and Military Families","N/A","3,957","511","21.93 USD","03/10/17 05:51:53 AM PST","N/A"
"3197","#BlackDontCrack
Lisa Bonet and her daughter Zoe Kravitz could pass as twins! Beautiful
women!","https://www.facebook.com/Black4Black-1268698556482143/","- Living In: United States
Interests: Martin Luther King, Jr., African-American Civil Rights Movement
(1954-68), African-American history or Malcolm X","N/A","18 - 65+","N/A","News Feed on desktop computers or News Feed on mobile
devices","N/A","N/A","5,107","689","200.00 RUB","02/01/17 04:56:57 AM PST","02/02/17 04:56:57 AM PST"
"1053","repost","https://www.facebook.com/Blacktivist-128371547505950/","United States","N/A","16 - 65+","English (UK) or English (US)","News Feed on desktop computers or News Feed on mobile
devices","Interests: Black nationalism, Pan-Africanism, Police
misconduct, African-American culture, African-American Civil Rights
Movement ( 1954-68), African-American history, Black Consciousness
Movement, Martin Luther King Ill, Stop Police Brutality or Black (Color)","N/A","17,905","2,328","253.70 RUB","03/14/17 07:01:00 AM PDT","03/15/17 12:00:00 PM PDT"
"3153","And how can we ever forget The G.O.A.T. for saving this man's life.
""You are my brother. and I want to help you."" Ali said to the man.
#PanAfricanism #BlackNationalism #BlackEmpowerment
#African Empowerment #AfricanAndProud #BlackAndProud #BlackPride
#BlackPower #BlackLivesMatter #Amerikkka #UnapologeticallyBlack
#UnapologeticallyAfrican #BlacklnAmerica #BlacklsBeautiful #KnowThySelf
#KnowledgeOfSelf #KnowledgeOfSelflsANationaIity
#EconomicEmpowerment #Integration Failed #WhiteLiesMatter #Education
#African Unification #AfricanUnity #BlackLove #JusticeOrElse #ProBlack
#Regrann #blackexcellence #goals","https://www.facebook.com/Woke-Blacks-294234600956431/","- Living In: United States
Interests: Martin Luther King; Jr., African-American Civil Rights Movement
(1954-68), African-American history or Malcolm X","N/A","18 - 65+","N/A","News Feed on desktop computers or News Feed on mobile
devices","N/A","N/A","6,986","1,171","130.15 RUB","02/17/17 05:31:06 AM PST","02/20/17 05:31:06 AM PST"
"2550","My first 10 photos. Want more? Help me to contact Facebook, to make my
own sticker pack!","https://www.facebook.com/Panther-Melanie-108262656357537/","United States: Palo Alto (+10 mi) California","N/A","18 - 65+
Gender: Male","English (US)","News Feed on desktop computers, Instagram Feed or News
Feed on mobile devices","Employers: Facebook","N/A","0","0","None","01/31/17 05:44:25 AM PST","N/A"
"1168","Commemorate the ""Black History Month"" and celebrate this month with our
legit t-shirts.
https://www.facebook.com/pg/blacktivists/shop/?rid=128371547505950&rt=6
www.facebook.com facebook.com","https://www.facebook.com/blacktivists/shop/?rid=128371547505950&rt=6","United States","N/A","16 - 65+","English (UK) or English (US)","News Feed on desktop computers or News Feed on mobile
devices","Interests: Pan-Africanism, African-American Civil Rights
Movement (1954-68), African-American history or Black (Color)","N/A","2,122","55","300.00 RUB","02/02/17 03:52:58 AM PST","02/03/17 03:52:58 AM PST"
