"Ad ID","Ad Text","Ad Landing Page","Ad Targeting Location","Excluded Connections","Age","Language","Placements","People Who Match","Friends of Connections","Ad Impressions","Ad Clicks","Ad Spend","Ad Creation Date","Ad End Date"
"3384","Finely selected conservative memes that make them cry again! Nothing Left","https://www.facebook.com/Nothing-Left-3623656574523741","- Living In: United States","N/A","20 - 45","English (US)","News Feed on desktop computers, News Feed on mobile
devices or Right column on desktop computers","Politics: Likely to engage with political content
(conservative)
And Must Also Match: Interests: Far-right politics, White nationalism, Internet
meme or Right-wing politics","N/A","0","0","0","02/09/17 01:48:24 AM PST","N/A"
"3340","Join the event, bring your friends, feel safe with us!
Don't miss the opportunity to train with our coach in
ou will enjoy it for sure.
It's free! Organized on a donation basis. Free Self-Defense class in Tampa, Fl","https://www.facebook.com/events/1546409575376750/","- Living In: United States: Tampa (+25 mi) Florida","N/A","18 - 65+","English (UK) or English (US)","News Feed on desktop computers or News Feed on mobile
devices","Interests: Mixed martial arts, Martial arts, The Women's
Self Defense Institute, PERSONAL & HOME DEFENSE, Self-defense, Self-
defense (United States), Personal Defense, Right of self-defense, Self
Defense Family or Active Self Protection
And Must Also Match: Interests: Martin Luther King, Jr., Pan-Africanism,
Black Power, African American, Black history, Black Panther Party, African-
American culture, African-American Civil Rights Movement (1954-68), Black
History Month, African-American history, Angela Davis, Malcolm X or Black
(Color)","N/A","0","0","0","03/21/17 08:20:31 AM PDT","02/28/17 05:00:00 AM PST"
"3381","Finely selected conservative memes that make them cry again! Nothing Left","https://www.facebook.com/Nothing-Left-3623656574523741","- Living In: United States","N/A","20 - 45","English (US)","News Feed on desktop computers, News Feed on mobile
devices or Right column on desktop computers","Politics: Likely to engage with political content
(conservative)
And Must Also Match: Interests: Far-right politics, White nationalism, Internet
meme or Right-wing politics","N/A","488","20","458.75 RUB","02/09/17 01:49:21 AM PST","N/A"
"3370","Self-Defense Project. Feel safe with us. Black Fist","https://www.facebook.com/Black-Fist-966468950153780/","United States","Exclude people who like Fit Black","18 - 65+","English (UK) or English (US)","News Feed on desktop computers, News Feed on mobile
devices or Right column on desktop computers","Interests: Martin Luther King, Jr., African-American
culture, African-American Civil Rights Movement (1954-68), African-American
history or Malcolm X
And Must Also Match: Interests: The Women's Self Defense Institute, Self-
defense, Personal Defense, Right of self-defense or Active Self Protection","N/A","9,952","621","4,470.71 RUB","02/01/17 03:43:13 AM PST","N/A"
"1049","repost @[1685853058396977:274:Melaninvibez]","https://www.facebook.com/blacktivists/","United States","N/A","16 - 65+","English (UK) or English (US)","News Feed on desktop computers or News Feed on mobile
devices","Interests: Pan-Africanism, African-American Civil Rights
Movement (1954-68), African-American history or Black (Color)","N/A","56,988","7,849","282.73 RUB","03/14/17 07:00:38 AM PDT","03/15/17 10:00:00 AM PDT"
"3362","N/A","N/A","- Living In: United States: New York (+25 mi) New York","N/A","18 - 65+","English (UK) or English (US)","News Feed on desktop computers or News Feed on mobile
devices","Interests: Mixed martial arts, Martial arts, The Women's
Self Defense Institute, PERSONAL & HOME DEFENSE, Self-defense, Self-
defense (United States), Personal Defense, Right of self-defense, Self
Defense Family or Active Self Protection
And Must Also Match: Interests: Martin Luther King, Jr., Pan-Africanism,
Black Power, African American, Black history, Black Panther Party, African-
American culture, African-American Civil Rights Movement (1954-68), Black
History Month, African-American history, Angela Davis, Malcolm X or Black
(Color)","N/A","0","0","0","03/21/17 08:20:13 AM PDT","03/23/17 08:18:03 AM PDT"
"2890","Let's stand united to defend our faith as an army of Jesus! Army Of Jesus","https://www.facebook.com/Army-of-Jesus-1195795607160174/","- Living In: United States","N/A","18 - 65+","N/A","News Feed on desktop computers or Right column on desktop
computers","Interests: jesus love u or I Have Decided to Follow Jesus
And Must Also Match: Interests: Jesus","N/A","0","0","None","01/10/17 02:20:28 AM PST","N/A"
"2777","God Bless Dixie! The South will rise again!","https://www.facebook.com/South-United-1777037362551238/","United States","Exclude people who like South United","18 - 65+","English (UK) or English (US)","News Feed on desktop computers, News Feed on mobile
devices or Right column on desktop computers","Interests: Confederate Flag, Confederate States Army,
Southern Pride, My Big Redneck Family or Redneck Nation","N/A","1","0","0","02/20/17 06:48:46 AM PST","N/A"
"3326","Join the event, bring your friends, feel safe with us!
Don't miss the opportunity to train with our coach
ou will enjoy it for sure.
It's free! Organized on a donation basis. Free Self-Defense class in Tampa, Fl","https://www.facebook.com/events/450671001935703/","- Living In: United States: Tampa (+25 mi) Florida","N/A","18 - 65+","English (UK) or English (US)","News Feed on desktop computers or News Feed on mobile
devices","Interests: Mixed martial arts, Martial arts, The Women's
Self Defense Institute, PERSONAL & HOME DEFENSE, Self-defense, Self-
defense (United States), Personal Defense, Right of self-defense, Self
Defense Family or Active Self Protection
And Must Also Match: Interests: Martin Luther King, Jr., Pan-Africanism,
Black Power, African American, Black history, Black Panther Party, African-
American culture, African-American Civil Rights Movement (1954-68), Black
History Month, African-American history, Angela Davis, Malcolm X or Black
(Color)","N/A","1,309","61","1,500.00 RUB","03/22/17 05:22:25 AM PDT","03/28/17 05:22:25 AM PDT"
"3337","Join the event, bring your friends, feel safe with us
It's free! Organized on a donation basis. https://www.meetup.com/Black-Fist-
Self-Defense-ProjecU             Free Self-Defense class for kids","https://www.meetup.com/Black-Fist-Self-Defense-Project/","- Living In: United States: New York (+25 mi) New York","N/A","18 - 65+","English (UK) or English (US)","News Feed on desktop computers or News Feed on mobile
devices","Interests: Martin Luther King, Jr., Pan-Africanism, Black
Power, Martial arts, African American, Black history, Black Panther Party,
African-American culture, African-American Civil Rights Movement (1954--68),
Black History Month, African-American history, Angela Davis, Malcolm X, Self
Defense Family, Black (Color) or The Self Defense Company
And Must Also Match: Interests: Mixed martial arts, Martial arts, The Women's
Self Defense Institute, PERSONAL & HOME DEFENSE, Self-defense, Self-
defense (United States), Personal Defense, Right of self-defense, Self
Defense Family or Active Self Protection","N/A","1,711","56","1,000.00 RUB","03/31/17 06:56:37 AM PDT","04/01/17 06:56:37 AM PDT"
"3137","A word to the wise...! James Baldwin said it all.
#PanAfricanism #BlackNationalism #BlackEmpowerment
#African Empowerment #AfricanAndProud #BlackAndProud #BlackPride
#BlackPower #BlackLivesMatter #Amerikkka #UnapologeticallyBlack
#UnapologeticallyAfrican #BlacklnAmerica #BlacklsBeautiful #KnowThySelf
#KnowledgeOfSelf #KnowledgeOfSelflsANationaIity
#EconomicEmpowerment #Integration Failed #WhiteLiesMatter #Education
#African Unification #AfricanUnity #BlackLove #JusticeOrElse #ProBlack","https://www.facebook.com/Woke-Blacks-294234600956431/","- Living In: United States
Interests: Martin Luther King; Jr., African-American Civil Rights Movement
(1954-68), African-American history or Malcolm X","N/A","18 - 65+","N/A","News Feed on desktop computers or News Feed on mobile
devices","N/A","N/A","10,110","1,461","300.00 RUB","01/31/17 03:22:31 AM PST","02/01/17 03:22:31 AM PST"
"3307","N/A","https://www.facebook.com/Hell_and_Back-1806743482876111/","- Living In: United States","N/A","18 - 65+","N/A","News Feed on desktop computers or News Feed on mobile
devices","Interests: Prison-industrial complex, Corrections
Corporation of America , American Correctional Association, Incarceration in
the United States, Prisoner, The Inmates, Children Of Inmates, Prison Wives
or School-to-prison pipeline","N/A","0","0","0","02/13/17 07:32:39 AM PST","02/14/17 07:32:39 AM PST"
"2566","LIKE for all the Mexican, Salvadorian, Guatemalan, Honduran, Nicaraguan &
Immigrant dads!","https://www.facebook.com/brownunitedfront/","- Living In: United States","N/A","18 - 65+","N/A","News Feed on desktop computers or News Feed on mobile
devices","Interests: Hispanic and latino american culture, Mexico,
Mexican american culture, Hispanic culture, Latino culture, Latin hip hop,
Chicano, Chicano Movement, Hispanidad, Mexican Pride, Lowrider, Chicano
rap or La Raza","N/A","26,625","3,563","400.00 RUB","03/24/17 09:30:06 AM PDT","03/25/17 09:52:00 AM PDT"
"3141","I have always admired the strength of Black women to strive for success and
here i serve us all again with this delighting success of Barbara Ross-Lee, a
physician and the first African-American woman to become the dean of a
predominantly white medical school.
Thank you for your inspiration; paving the way for young Black girls to dream
bigger and achieve greater heights.
#PanAfricanism #BlackNationalism #BlackEmpowerment
#African Empowerment #AfricanAndProud #BlackAndProud #BlackPride
#BlackPower #BlackLivesMatter #Amerikkka #UnapologeticallyBlack
#UnapologeticallyAfrican #BlacklnAmerica #BlacklsBeautiful #KnowThySelf
#KnowledgeOfSelf #KnowledgeOfSelfIsANationaIity
#EconomicEmpowerment #Integration Failed #WhiteLiesMatter #Education
#African Unification #AfricanUnity #BlackLove #JusticeOrElse #ProBlack
#Regrann #blackexcellence #goals","https://www.facebook.com/Woke-Blacks-294234600956431/","- Living In: United States
Interests: Martin Luther King, Jr., African-American Civil Rights Movement
(1954-68), African-American history or Malcolm X","N/A","18 - 65+","N/A","News Feed on desktop computers or News Feed on mobile
devices","N/A","N/A","34,318","5,841","300.00 RUB","02/22/17 05:59:28 AM PST","02/25/17 05:59:28 AM PST"
"3348","Join the event, bring your friends, feel safe with us!
Don't miss the opportunity to train outdoors!
It's free! Organized on a donation basis. Free Self-defense class in Orlando,
Fl","https://www.facebook.com/events/1659819367655435/","- Living In: United States: Orlando (+50 mi) Florida","N/A","18 - 65+","English (UK) or English (US)","News Feed on desktop computers or News Feed on mobile
devices","Interests: Martin Luther King, Jr., Pan-Africanism, Black
Power, African American , Black history, Black Panther Party, African-
American culture, African-American Civil Rights Movement (1954-68), Black
History Month, African-American history, Angela Davis, Malcolm X or Black
(Color)
And Must Also Match: Interests: Mixed martial arts, Martial arts, The Women's
Self Defense Institute, PERSONAL & HOME DEFENSE, Self-defense, Self-
defense (United States), Personal Defense, Right of self-defense, Self
Defense Family or Active Self Protection","N/A","1,787","98","1,500.00 RUB","02/22/17 06:39:06 AM PST","02/25/17 08:00:00 AM PST"
"3289","Turning bureaucracy against themselves.
We have suffered a 40pc unemployment rate from layers of federal regulation
applied only to tribal lands, but it hasn't stop Fort Berthold from becoming
one of the state's most productive regions. Currently a coalition of Native
Americans appointed by to guide country's Indian policy is researching
proposals to make energy development easier on tribal lands - including the
idea of transferring them to private ownership. This way, big corporations
finally won't be allowed to rob and destroy our lands. We are strong not only
by our unparalleled unity, but also by our ability to see the bigger picture.","https://www.facebook.com/Native-Americans-United-386046198404902/","- Living In: United States","N/A","18 - 65+","N/A","News Feed on desktop computers or News Feed on mobile
devices","Interests: American Indian Movement, Native American
Indian Wisdom, Cherokee language or Cherokee Nation","N/A","780","88","200.00 RUB","02/07/17 03:38:09 AM PST","02/08/17 03:38:09 AM PST"
"3296","Native American teens made an interesting journey through their ancestral
lands. The journey was led by Sarah Pemberton member of the Delaware
Nation. Sarah and her partner Kyle Harris created a movie about the journey
called ""The Water Gap: Return to the Homelands"" which already won the
award at the Native American Film Festival of the Southeast.
Propaganda of native culture and traditions is one of most powerful weapons
in Native American fight for their rights. People have always tried to destroy
things they don't understand. And white people never understood native
culture properly. Many teens who had native ancestors deep in the past know
nothing about their culture. Films, journeys, even videos on Youtube, can
help.","https://www.facebook.com/Native-Americans-United-386046198404902/","- Living In: United States","N/A","18 - 65+","N/A","News Feed on desktop computers or News Feed on mobile
devices","Interests: American Indian Movement, Native American
Indian Wisdom, Cherokee language or Cherokee Nation","N/A","345","27","200.00 RUB","01/31/17 11:31:59 PM PST","02/01/17 11:31:59 PM PST"
"2711","And maybe mom is right loll.","https://www.facebook.com/brownunitedfront/","- Living In: United States","N/A","18 - 65+","N/A","News Feed on desktop computers or News Feed on mobile
devices","Interests: Mexico. Latin hip hop, Chicano Movement,.
Hispanidad, Lowrider, Chicano rap or La Raza","N/A","2,797","255","96.32 RUB","03/14/17 07:37:34 AM PDT","03/15/17 12:30:00 PM PDT"
"2719","Edward James Olmos in Zoot Suit","https://www.facebook.com/brownunitedfront/","- Living In: United States","N/A","18 - 65+","N/A","News Feed on desktop computers or News Feed on mobile
devices","Interests: Mexico. Latin hip hop. Chicano Movement,.
Hispanidad, Lowrider, Chicano rap or La Raza","N/A","29,136","4,168","400.00 RUB","02/22/17 06:50:37 AM PST","02/23/17 06:50:37 AM PST"
"2736","Be proud of who you are!","https://www.facebook.com/brownunitedfront/","- Living In: United States","N/A","18 - 65+","N/A","News Feed on desktop computers or News Feed on mobile
devices","Interests: Mexico. Latin hip hop. Chicano Movement,.
Hispanidad, Lowrider, Chicano rap or La Raza","N/A","22,461","3,283","179.96 RUB","03/15/17 08:00:08 AM PDT","03/16/17 11:05:00 AM PDT"
"3241","LIKE if you've ever felt that way!","https://www.facebook.com/brownunitedfront/","- Living In: United States","N/A","18 - 65+","N/A","News Feed on desktop computers or News Feed on mobile
devices","Interests: Mexican american culture; Hispanic american
culture, Chicano, Chicano Movement. Being Latino, Mexican Pride, So
Mexican, La Raza or Mexican American Pride","N/A","18,213","2,310","200.00 RUB","03/17/17 08:19:49 AM PDT","03/18/17 08:19:49 AM PDT"
"2793","Support our Veterans!","https://www.facebook.comNeterans-Come-First-I757336424535312/","- Living In: United States","Exclude people who like Veterans Come First","18 - 65+","N/A","News Feed on desktop computers, News Feed on mobile
devices or Right column on desktop computers","Interests: Veterans, United States Department of
Veterans Affairs, Disabled American Veterans or Supporting Our Veterans
And Must Also Match: Employers: U.S. Army Reserve, Job title: Veteran,
Industry: Military (Global) or Veterans(US)","N/A","47","3","56.11 RUB","02/21/17 05:17:24 AM PST","N/A"
"2784","Support our Veterans! Veterans Come First","https://www.facebook.comNeterans-Come-First-I757336424535312/","- Living In: United States
Interests: Veterans, United States Department of Veterans Affairs, Disabled
American Veterans or Supporting Our Veterans
Home Composition: Veterans in home","Exclude people who like Veterans Come First","18 - 39","N/A","News Feed on desktop computers, News Feed on mobile
devices or Right column on desktop computers","N/A","N/A","0","0","None","02/21/17 01:13:46 AM PST","N/A"
"2373","On December 3rd the KKK terrorist organization will host a ""victory"" parade in
North Carolina to celebrate the election of Donald Trump.
Join us on Dec. 3 in Marshall Park. Charlotte as we voice our opposition to
the Klan demonstration, their hateful agenda, violence and oppression!
Charlotte Against Hate","https://www.facebook.com/events/1795123670705170/","- Living In: United States: Charlotte (+25 mi) North Carolina","N/A","18 - 65+","N/A","News Feed on desktop computers or News Feed on mobile
devices","Interests: Martin Luther King. Jr. African-American Civil
Rights Movement (1954-68). African-American history; Malcolm X or Legal
education","N/A","0","0","None","02/22/17 07:05:06 AM PST","12/03/16 01:00:00 PM PST"
"3118","Ladies & Gents, today we remember one of the realest ever Lone Rangers,.
Bass Reeves. Mostly described as the ""lawman second to none,"" a man who
was ""absolutely fearless and also labelled, the Black Hero Marshal.
Reeves was born to slave parents in 1838 in Crawford County Arkansas, but
Bass Reeves would become the first black U.S. Deputy Marshal west of the
Mississippi River and one of the greatest frontier heroes in the history of this
country.
#PanAfricanism #BlackNationalism #BlackEmpowerment
#African Empowerment #AfricanAndProud #BlackAndProud #BlackPride
#BlackPower #BlackLivesMatter #Amerikkka #UnapologeticallyBlack
#UnapologeticallyAfrican #BlacklnAmerica #BlacklsBeautiful #KnowThySelf
#KnowledgeOfSelf #KnowledgeOfSelfIsANationaIity
#EconomicEmpowerment #Integration Failed #WhiteLiesMatter #Education
#African Unification #AfricanUnity #BlackLove #JusticeOrElse #ProBlack
#Regrann #blackexcellence #goals #woke","https://www.facebook.com/Woke-Blacks-294234600956431/","- Living In: United States
Interests: Martin Luther King, Jr., African-American Civil Rights Movement
(1954-68), African-American history or Malcolm X","N/A","18 - 65+","N/A","News Feed on desktop computers or News Feed on mobile
devices","N/A","N/A","13,292","2,290","200.00 RUB","02/17/17 05:32:12 AM PST","02/18/17 05:32:12 AM PST"
"2999","You are an Awesome God, i will forever praise you for your goodness. love
and kindness.
#ittakestime #soblessed #waitingonthelord
#lord #amen #hallelujah #salvation #Blacksforchrist #jesus #jesussaves
#prayer #jesusistruth #jesusforall #liveforchrist #america #saved #christians
#christfanatics #Jesus #Christ #Cristo #church #amor Move #God
#jesuslovesyou #jesuschrist #prayer #Godisincontrol #praisebetotheLord","https://www.facebook.com/Black_Baptist_church-1160193507389202/","- Living In: United States","N/A","18 - 65+","N/A","News Feed on desktop computers or News Feed on mobile
devices","Interests: Martin Luther King, Jr., Pentecostalism,
Baptism ; Presbyterianism, Lutheranism, Baptism of Jesus or Jesus","N/A","0","0","None","01/31/17 03:30:55 AM PST","02/01/17 03:30:55 AM PST"
"2265","Black woman are truly making history each day.","https://www.facebook.com/blackmattersus.mvmnt","- Living In: United States
Connections: People who like BM","N/A","18 - 65+","N/A","News Feed on desktop computers or News Feed on mobile
devices","N/A","N/A","2,289","481","100.00 RUB","03/23/17 02:25:14 AM PDT","03/24/17 02:25:14 AM PDT"
"3000","God created you and loves you! Never forget!?
.#ittakestime #soblessed #waitingonthelord#lord #amen #hallelujah #salvation
#Blacksforchrist #jesus #jesussaves #prayer #jesusistruth #jesusforall
#liveforchrist #america #saved #christians #christfanatics #Jesus #Christ
#Cristo #church #amor #love #God #jesuslovesyou #jesuschrist #prayer
#Godisincontrol #praisebetotheLord","https://www.facebook.com/Black—Baptist—church-1160193507389202/","- Living In: United States","N/A","18 - 65+","N/A","News Feed on desktop computers or News Feed on mobile
devices","Interests: Martin Luther King, Jr., Pentecostalism,
Baptism, Presbyterianism, Lutheranism, Baptism of Jesus or Jesus","N/A","0","0","None","01/31/17 03:30:17 AM PST","02/07/17 03:30:17 AM PST"
"3317","The second self-defense class                                   Join the event, bring
your friends, feel safe with us!!! Self-defense classes with","https://www.facebook.com/events/694209204073106/","United States: Astoria (+25 mi) New York","N/A","18 - 65+","English (UK) or English (US)","News Feed on desktop computers or News Feed on mobile
devices","Interests: Martin Luther King, Jr., Pan-Africanism, Black
Power, African American , Black history, Black Panther Party, African-
American culture, African-American Civil Rights Movement (1954-68), Black
History Month, African-American history, Angela Davis, Malcolm X or Black
(Color), Multicultural Affinity: African American (US)
And Must Also Match: Interests: Mixed martial arts, Martial arts, The Women's
Self Defense Institute, PERSONAL & HOME DEFENSE, Self-defense, Self-
defense (United States), Personal Defense, Right of self-defense, Self
Defense Family or Active Self Protection","N/A","0","0","0","02/10/17 04:54:43 AM PST","02/11/17 03:29:15 PM PST"
"2637","Mexicas have solution to everything!","https://www.facebook.com/brownunitedfront/","- Living In: United States","N/A","18 - 65+","N/A","News Feed on desktop computers or News Feed on mobile
devices","Interests: Hispanic and latino american culture, Mexico,
Mexican american culture, Hispanic culture, Latino culture, Latin hip hop,
Chicano. Chicano Movement, Hispanidad, Mexican Pride, Lowrider, Chicano
rap or La Raza","N/A","28,035","3,620","400.00 RUB","03/24/17 09:31:04 AM PDT","03/25/17 12:30:00 PM PDT"
"3112","Dr. King preached to thousands and millions, all in an attempt to gain ""true
liberation for the oppressed, Black people.
Years after his death, we still march on streets like he did. We still ask and
beg and plead. Maybe it's time to change tactics?
#blackexcellence #PanAfricanism #BlackNationalism #BlackEmpowerment
#African Empowerment #AfricanAndProud #BlackAndProud #BlackPride
#BlackPower #BlackLivesMatter #Amerikkka #UnapologeticallyBlack
#UnapologeticallyAfrican #BlacklnAmerica #BlackIsBeautiful #KnowThySelf
#KnowledgeOfSelf #KnowledgeOfSelflsANationality
#EconomicEmpowerment #Integration Failed #WhiteLiesMatter #Education
#African Unification #AfricanUnity #BlackLove #JusticeOrElse #ProBlack
#Regrann #blackexcellence","https://www.facebook.com/Woke-Blacks-294234600956431/","- Living In: United States
Interests: Martin Luther King, Jr., African-American Civil Rights Movement
(1954-68), African-American history or Malcolm X","N/A","18 - 65+","N/A","News Feed on desktop computers or News Feed on mobile
devices","N/A","N/A","0","0","None","03/15/17 08:06:40 AM PDT","04/01/17 08:00:00 AM PDT"
"1024","You won't stop laughing if you watch this video. #FatherDaughterTalk","https://www.facebook.com/Blacktivist-128371547505950/","United States","N/A","16 - 65+","English (UK) or English (US)","News Feed on desktop computers or News Feed on mobile
devices","Interests: Black nationalism, Pan-Africanism, Police
misconduct, African-American culture, African-American Civil Rights
Movement ( 1954-68), African-American history, Black Consciousness
Movement, Martin Luther King Ill, Stop Police Brutality or Black (Color)","N/A","253,726","23,021","491.23 RUB","02/22/17 06:15:48 AM PST","02/23/17 06:15:48 AM PST"
"2794","Support our Veterans!","https://www.facebook.comNeterans-Come-First-I757336424535312/","- Living In: United States","Exclude people who like Veterans Come First","18 - 54","N/A","News Feed on desktop computers, News Feed on mobile
devices or Right column on desktop computers","Interests: Veterans, United States Department of
Veterans Affairs, Disabled American Veterans or Supporting Our Veterans
And Must Also Match: Employers: U.S. Army Reserve, Job title: Veteran,
Industry: Military (Global) or Veterans(US)","N/A","0","0","None","02/22/17 02:24:13 AM PST","N/A"
"2785","Support our Veterans!","https://www.facebook.comNeterans-Come-First-I757336424535312/","- Living In: United States","Exclude people who like Veterans Come First","18 - 39","N/A","News Feed on desktop computers, News Feed on mobile
devices or Right column on desktop computers","Interests: Veterans, United States Department of
Veterans Affairs, Disabled American Veterans or Supporting Our Veterans","N/A","0","0","None","02/21/17 05:16:27 AM PST","N/A"
"3245","LIKE if you've ever felt that way!","https://www.facebook.com/brownunitedfront/","United States","N/A","18 - 65+","N/A","on pages: News Feed on desktop computers, Instagram Feed,
News Feed on mobile devices. Right column on desktop computers or Instant
Article","N/A","N/A","1","0","0.88 RUB","03/17/17 07:56:43 AM PDT","N/A"
"2712","And she was gorgeous. Never forget","https://www.facebook.com/brownunitedfront/","- Living In: United States","N/A","18 - 65+","N/A","News Feed on desktop computers or News Feed on mobile
devices","Interests: Mexico. Latin hip hop. Chicano Movement,.
Hispanidad, Lowrider, Chicano rap or La Raza","N/A","13,777","1,925","400.00 RUB","02/22/17 06:52:02 AM PST","02/23/17 06:52:02 AM PST"
"2720","Bibles, guns and disease...","https://www.facebook.com/brownunitedfront/","- Living In: United States","N/A","18 - 65+","N/A","News Feed on desktop computers or News Feed on mobile
devices","Interests: Mexico. Latin hip hop. Chicano Movement,.
Hispanidad, Lowrider, Chicano rap or La Raza","N/A","7,753","1,025","200.00 RUB","02/16/17 12:42:21 AM PST","02/17/17 12:42:21 AM PST"
