"Ad ID","Ad Text","Ad Landing Page","Ad Targeting Location","Excluded Connections","Age","Language","Placements","People Who Match","Friends of Connections","Ad Impressions","Ad Clicks","Ad Spend","Ad Creation Date","Ad End Date"
"2872","Let's celebrate their succes together!","https://www.facebook.com/Pan-African-roots-MOVE-265201130527872/","- Living In: United States","Exclude people who like Pan-African roots MOVE","18 - 65+","English (UK)or English (US)","News Feed on desktop computers or News Feed on mobile
devices","Interests: Martin Luther King, Jr., Black history, African-
American Civil Rights Movement(1954-68), African-American history,
Malcolm X or Black (Color)","N/A","4,020","552","300.00 RUB","02/01/17 04:46:24 AM PST","02/02/17 04:46:24 AM PST"
"2360","Impressive, isn't it? Black don't crack!","https://www.facebook.com/blackmattersus.mvmnt/","- Living In: United States","N/A","18 - 65+","N/A","News Feed on desktop computers or News Feed on mobile
devices","Interests: Martin Luther King, Jr.; African-American Civil
Rights Movement (1954-68), African-American history or Malcolm X","N/A","0","0","None","03/24/17 03:07:26 AM PDT","03/25/17 08:27:00 AM PDT"
"971","Black grandma will always find a way to support her grandkids.","https://www.facebook.com/blacktivists/","United States","N/A","16 - 65+","English (UK)or English (US)","News Feed on desktop computers or News Feed on mobile
devices","Interests: Black nationalism, Pan-Africanism, Police
misconduct, African-American culture, African-American Civil Rights
Movement(1954-68), African-American history, Black Consciousness
Movement, Martin Luther King III, Stop Police Brutality or Black (Color)","N/A","38,624","6,915","200.00 RUB","03/23/17 02:51:16 AM PDT","03/26/17 08:00:00 AM PDT"
"2472","Shelden Gibbs is only 11-year-old but he's already started a fashion
accessory line! Gibbs produces at least 5 original ties each day! His mom
helps him. They called their company Classic Knot. Their customers are so
happy to wear these ties that Classic Knot is going to hire some extra
employees!
By the way this business is not an obstacle for school. Shelden's classmates
even offer their help too!
""I teach him the sky is the limit from here. Dream big, think big, don't think
small or you'll always have small,"" said Shelden's mother Rhonda Woods and
she's absolutely right! It's so good that kids are thinking of pleasing other
people and supporting their families!
Check Classic Knot website!
www.classicknot.com
#blackexcellence #blackperfection #blackbeauty #blackbusiness
#africanamerican #blackcommunity #melanin #blackpride #blackout #america
#usa #blackscience #education #diversity #classicknot #buyblack","https://www.facebook.com/iloveblackexcellence/","- Living In: United States","N/A","18 - 65+","N/A","News Feed on desktop computers or News Feed on mobile
devices","Interests: Martin Luther King, Jr., My Black is Beautiful,
Black is beautiful or Black Girls Rock!","N/A","2,589","402","348.10 RUB","03/22/17 04:31:35 AM PDT","03/23/17 04:31:35 AM PDT"
"2476","Drum and Spear Bookstore in Washington DC was opened by veteran
members of the Student Nonviolent Coordinating Committee(SNCC) in
summer of 1968. The shop was selling the books of black writers. The next
year the owners of Drum and Spear launched its own publishing company.
One of co-founders said ""We don't define profit in terms of money. The profit
is the patronage of the community, which allows the store to self-support.""
Drum and Spear was aimed to show people the true black culture and history,
something beyond the American school program. It's reflected in the name of
the shop: the drum is for ""communications within the diaspora,"" and the
spear symbolizes ""whatever else might be necessary for the liberation of the
people.""
The best-sellers of early 70s in this shop were such books as the
Autobiography of Malcolm X and Eldridge Cleaver's Soul on Ice.
This bookstore inspired people around the country to open similar bookstores.
Drum and Spear and many other stores were not only the shops, but a ""free
spaces""for thinking black people where folks could meet and discuss the vital
issues. Let's not forget our legacy! We need this drum and we need this spear
today, in 2017.
#blackexcellence #blackperfection #blackbeauty #blackbusiness
#africanamerican #blackcommunity #melanin #blackpride #blackout #america
#usa #blackscience #education #diversity #drumandspear #blackpower","https://www.facebook.com/iloveblackexcellence/","- Living In: United States","N/A","18 - 65+","N/A","News Feed on desktop computers or News Feed on mobile
devices","Interests: Martin Luther King, Jr., My Black is Beautiful,
Black is beautiful or Black Girls Rock!","N/A","942","141","200.00 RUB","02/01/17 05:04:17 AM PST","02/02/17 05:04:17 AM PST"
"2692","Our creativity comes from the ancestors","https://www.facebook.com/brownunitedfront/","- Living In: United States","N/A","18 - 65+","N/A","News Feed on desktop computers or News Feed on mobile
devices","Interests: Mexico. Latin hip hop. Chicano Movement,.
Hispanidad, Lowrider, Chicano rap or La Raza","N/A","30,198","4,178","400.00 RUB","03/23/17 08:03:15 AM PDT","03/24/17 10:11:00 AM PDT"
"2432","New ideas, old values. Join!","https://www.facebook.com/Born-Liberal-522628564598423/","- Living In: United States","Exclude people who like Born Liberal","45 - 65+","English (UK)or English (US)","News Feed on desktop computers or News Feed on mobile
devices","Interests: Bernie Sanders, Social democracy, Liberal
Democrats, Liberalism, LGBT community, Anti-racism or Anti-discrimination","N/A","0","0","None","02/22/17 05:40:21 AM PST","N/A"
"3392","Support our Veterans! Veterans Come First","https://www.facebook.comNeterans-Come-First-I757336424535312/","United States","Exclude people who like Veterans Come First","18 - 65+","N/A","News Feed on desktop computers, News Feed on mobile
devices or Right column on desktop computers","Interests: Military, Veterans or Family","N/A","147","5","2.36 USD","03/10/17 01:29:58 AM PST","N/A"
"3389","Do you want to see top 5 girls who applied for a job at Facebook?
Hit the link https://www.facebook.com/659489547567007/photos/a.65949001
7566960.1073741828.659489547567007/659491490900146/?type=3&theate
r","https://www.facebook.com/Melanie-Black-659489547567007/","- Living In: United States: Palo Alto (+10 mi) California","N/A","18 - 65+
Gender: Male","English (US)","News Feed on desktop computers or News Feed on mobile
devices","Employers: Facebook","N/A","533","19","10.00 USD","01/27/17 01:54:00 AM PST","01/29/17 01:54:00 AM PST"
"2552","Brown Power is a platform designed to educate, entertain and connect
Chicanos in the US.","https://www.facebook.com/brownunitedfront/","- Living In: United States","Exclude people who like Brown Power","16 - 65+","Spanish, English (UK), English (US)or Spanish (Spain)","News Feed on desktop computers, News Feed on mobile
devices or Right column on desktop computers","Interests: Mexico, Latin hip hop, Chicano Movement,
Hispanidad, Lowrider or Chicano rap
And Must Also Match: Interests: La Raza","N/A","126,749","5,707","11,122.34 RUB","03/23/17 12:24:36 AM PDT","05/12/17 12:45:00 PM PDT"
"1186","When ballet dancers can mix modern dance and ballet. When ballet dancers
can mix modern dance and ballet.","https://www.facebook.com/Blacktivist-128371547505950/","United States","N/A","16 - 65+","English (UK) or English (US)","News Feed on desktop computers or News Feed on mobile
devices","Interests: Black nationalism, Pan-Africanism, Police
misconduct, African-American culture, African-American Civil Rights
Movement ( 1954-68), African-American history, Black Consciousness
Movement, Martin Luther King Ill, Stop Police Brutality or Black (Color)","N/A","0","0","0","02/09/17 03:48:08 AM PST","02/10/17 03:48:08 AM PST"
"2942","The community of 2nd Amendment supporters, guns lovers & patriots","https://www.facebook.com/savethe2a/","- Living In: United States","Exclude people who like Defend the 2nd","18 - 65+","N/A","News Feed on desktop computers, News Feed on mobile
devices or Right column on desktop computers","Politics: Likely to engage with political content
(conservative)
And Must Also Match: Interests The Second Amendment or Gun Owners of
America","N/A","3,281","236","1,179.09 RUB","02/15/17 04:01:32 AM PST","N/A"
"2948","Masterpiece:","https://www.facebook.com/savethe2a/","- Living In: United States","N/A","18 - 65+","N/A","News Feed on desktop computers or News Feed on mobile
devices","Interests: Gun Owners of America. Concealed carry,
Concealed carry in the United States, National Association for Gun Rights,
Guns & Ammo or Students for Concealed Carry","N/A","0","0","None","02/10/17 06:56:40 AM PST","02/13/17 06:56:40 AM PST"
"966","Alek Wek is now a hero for many of us. Supermodel decided not to go with
the crowd that set the European standards of beauty. Despite the fact that all
of the fashion models were obliged to wear blond wigs, she did something
that was against the norm- she took her wig off and threw it in the crowd.
#YouGoGirl","https://www.facebook.com/blacktivists/","United States","N/A","16 - 65+","English (UK) or English (US)","News Feed on desktop computers or News Feed on mobile
devices","Interests: Pan-Africanism, African-American Civil Rights
Movement (1954-68), African-American history or Black (Color)","N/A","22,589","3,793","200.00 RUB","03/23/17 02:44:02 AM PDT","03/24/17 11:00:00 AM PDT"
"3376","The second self-defense class
your friends, feel safe with us!!! Self-defense classes","https://www.facebook.com/events/694209204073106/","United States: Astoria (+25 mi) New York","N/A","18 - 65+","English (UK) or English (US)","News Feed on desktop computers or News Feed on mobile
devices","Interests: African-American culture, African-American
Civil Rights Movement ( 1954-68), African-American history or Malcolm X
And Must Also Match: Interests: Mixed martial arts, Martial arts, The Women's
Self Defense Institute, PERSONAL & HOME DEFENSE, Self-defense, Self-
defense (United States), Personal Defense, Right of self-defense, Self
Defense Family or Active Self Protection","N/A","89","2","97.94 RUB","02/07/17 11:35:08 PM PST","02/11/17 03:29:15 PM PST"
"3064","Rest in peace! Thank you for trying to teach Black kids how to love
themselves!","https://www.facebook.com/WiIIiamsandKalvin/","- Living In: United States","N/A","18 - 65+","N/A","News Feed on desktop computers or News Feed on mobile
devices","Interests: Martin Luther King, Jr., African-American Civil
Rights Movement (1954-68). African-American history or Malcolm X","N/A","39,937","6,356","200.00 RUB","02/17/17 04:42:51 AM PST","02/20/17 04:42:51 AM PST"
"3099","#BlackHistoryMonth
Did you know that? Write in comment!","https://www.facebook.comNViIIiamsandKaIvin/","- Living In: United States","N/A","18 - 65+","N/A","News Feed on desktop computers or News Feed on mobile
devices","Interests: Martin Luther King, Jr., African-American Civil
Rights Movement (1954-68), African-American history or Malcolm X","N/A","31,192","5,058","369.01 RUB","02/05/17 11:14:39 PM PST","02/10/17 11:37:34 PM PST"
"2970","Protect the 2nd. Without it, you won't have any others! Join! Defend The 2nd","https://www.facebook.com/savethe2a/
AdTargetingCustomAudience:Lookalike(US,1%)-PeoplewholikeDefendthe2nd
Location-LivingIn:UnitedStates","N/A","Exclude people who like Defend the 2nd","18 - 65+","English (US)","News Feed on desktop computers, News Feed on mobile
devices or Right column on desktop computers","Politics: Likely to engage with political content
(conservative)
And Must Also Match: Interests: Second Amendment to the United States
Constitution","N/A","4,690","321","1,742.10 RUB","02/16/17 04:30:15 AM PST","N/A"
"2653","Noel Gugliemi is just great!","https://www.facebook.com/brownunitedfront/","- Living In: United States","N/A","18 - 65+","N/A","News Feed on desktop computers or News Feed on mobile
devices","Interests: Mexico. Latin hip hop. Chicano Movement,.
Hispanidad, Lowrider, Chicano rap or La Raza","N/A","21,209","3,404","198.81 RUB","03/28/17 08:23:06 AM PDT","03/29/17 10:22:00 AM PDT"
"1097","Today legendary performer Nina Simone would have been 84 years old.","https://www.facebook.com/Blacktivist-128371547505950/","United States","N/A","16 - 65+","English (UK) or English (US)","News Feed on desktop computers or News Feed on mobile
devices","Interests: Pan-Africanism, African-American Civil Rights
Movement (1954-68), African-American history or Black (Color)","N/A","19,037","2,717","291.73 RUB","02/22/17 06:15:13 AM PST","02/23/17 06:15:13 AM PST"
"2364","Officials of the Highlands High School are investigating a bizarre incident of a
racist student who posted on snapchat an image of a fake licensee to hunt
Black people. Officials of the Highlands High School are investigating a
bizarre incident of a racist student who posted on snapchat an image of a
fake licensee to hunt Black people. Racist Student Booted From School For
`N***r Hunting License' I BlackMattersUS.com blackmattersus.com","https://blackmattersus.com/20110-racist-student-booted-from-school-for-nr-
hunting-license/","- Living In: United States: Charlotte (+25 mi) North Carolina","N/A","18 - 65+","N/A","News Feed on desktop computers or News Feed on mobile
devices","Interests: Martin Luther King, Jr., African-American Civil
Rights Movement (1954-68), African-American history or Malcolm X","N/A","0","0","None","01/12/17 11:10:53 PM PST","12/08/16 11:34:46 PM PST"
"2788","Support our Veterans!","https://www.facebook.comNeterans-Come-First-I757336424535312/","- Living In: United States","Exclude people who like Veterans Come First","18 - 54","N/A","News Feed on desktop computers, News Feed on mobile
devices or Right column on desktop computers","Interests: Veterans, United States Department of
Veterans Affairs, Disabled American Veterans or Supporting Our Veterans,
Politics: Likely to engage with political content (conservative) or Likely to
engage with political content (moderate)
And Must Also Match: Employers: U.S. Army Reserve, Job title: Veteran,
Industry: Military (Global) or Veterans(US)","N/A","0","0","None","02/22/17 05:48:59 AM PST","N/A"
"1030","Make sure you guide your children and motivate them.","https://www.facebook.com/Blacktivist-128371547505950/","United States","N/A","16 - 65+","English (UK)or English (US)","News Feed on desktop computers or News Feed on mobile
devices","Interests: Black nationalism, Pan-Africanism, Police
misconduct, African-American culture, African-American Civil Rights
Movement(1954-68), African-American history, Black Consciousness
Movement, Martin Luther King III, Stop Police Brutality or Black (Color)","N/A","162,331","12,303","100.00 RUB","02/21/17 05:45:54 AM PST","02/22/17 05:45:54 AM PST"
"2764","Yep or Nope?","https://www.facebook.com/South-United-1777037362551238/","United States","Exclude people who like South United","18 - 65+","English (UK)or English (US)","News Feed on desktop computers or News Feed on mobile
devices","Interests: Confederate States of America
And Must Also Match: Interests: Flags of the Confederate States of America,
Hart of Dixie or Dixie","N/A","18,221","3,723","500.00 RUB","03/09/17 01:10:15 AM PST","03/10/17 01:10:15 AM PST"
"2385","We're proud to announce an initiative focused on providing free legal
education to empower our people and strengthen our community.
We believe that having these legal workshops on a monthly basis will prove to
be beneficial in a tangible way for our community
eet ou at                              Charlotte. NC Legal Night at=
i","https://www.facebook.com/events/651125608392879/","- Living In: United States: Charlotte (+25 mi) North Carolina","N/A","18 - 65+","N/A","News Feed on desktop computers or News Feed on mobile
devices","Interests: Civil law (common law), Administrative law,
Civil procedure or Legal education
And Must Also Match: Interests: Martin Luther King, Jr.; African-American
culture, African-American Civil Rights Movement (1954-68), African-American
history or Malcolm X","N/A","0","0","0","02/22/17 07:03:12 AM PST","01/28/17 04:51:04 AM PST"
"2781","Support our Veterans!","https://www.facebook.comNeterans-Come-First-I757336424535312/","- Living In: United States","Exclude people who like Veterans Come First","18 - 54","N/A","News Feed on desktop computers, News Feed on mobile
devices or Right column on desktop computers","Interests: Veterans, United States Department of
Veterans Affairs, Disabled American Veterans or Supporting Our Veterans,
Politics: Likely to engage with political content (conservative) or Likely to
engage with political content (moderate)
And Must Also Match: Employers: U.S. Army Reserve, Job title: Veteran,
Industry: Military (Global) or Veterans(US)","N/A","21","4","31.53 RUB","02/22/17 05:50:58 AM PST","N/A"
"3511","Do you remember the other Nice Peter vs Epiclloyd rap battle that took place
5 years ago?? Here's the new one! DudeTube Epic Rap Battles Of History
Season Finale. 2017-01-11 0 Comment Do you remember the other Nice
Peter vs Epiclloyd rap battle that took place 5 years ago?? Share on
FacebookShare on Twitter More ERB you can find on their youtube channel.
Epic Rap Battles Of History Season Finale. - DuDeers dudeers.com","http://dudeers.com/2017/01/11/epic-rap-battles-of-history-season-finale/","- Living In: United States","N/A","16 - 25","N/A","News Feed on desktop computers or News Feed on mobile
devices","Interests: Fail Blog, Internet meme, lmgur,
CollegeHumor, Reddit, BuzzFeed, Meme, Meme Center, NBA Memes or
iFunny","N/A","1,003","33","196.35 RUB","01/11/17 07:10:38 AM PST","01/12/17 07:10:38 AM PST"
"3508","Natalie Portman is a big star, but even she earns significantly less money
than here male co-stars. Celebro Natalie Portman Talks About The Gender
Wage Gap In Hollywood 2017-01-112017-01-11 0 Comment Natalie Portman
is a big star, but even she earns significantly less money than here male co-
stars. Share on FacebookShare on Twitter read more on E! Natalie Portman
Talks About The Gender Wage Gap In Hollywood — DuDeers dudeers.com","http://dudeers.com/2017/01/11/natalie-portman-talks-about-the-gender-wage-
gap-in-hollywood/","- Living In: United States","N/A","16 - 25","N/A","News Feed on desktop computers or News Feed on mobile
devices","Interests: Fail Blog, Internet meme, Imgur,
CollegeHumor, Reddit, BuzzFeed, Meme, Meme Center, NBA Memes or
iFunny","N/A","768","31","200.00 RUB","01/12/17 07:08:58 AM PST","01/13/17 07:08:58 AM PST"
"2715","How can we be illegal on our own land? The United States unfairly took from
Mexico what is now the Southwest of the country in the Treaty of Guadalupe
Hidalgo that ended the Mexican-U.S. War. The ceded territory included what
is now Texas, New Mexico. Arizona and California, and parts of Colorado,
Nevada and Utah. This greater area represents the point of parting of the
Aztec migrations.","https://www.facebook.com/brownunitedfront/","- Living In: United States","N/A","18 - 65+","N/A","News Feed on desktop computers or News Feed on mobile
devices","Interests: Mexico; Latin hip hop. Chicano Movement.
Hispanidad, Lowrider, Chicano rap or La Raza","N/A","37,133","5,303","800.00 RUB","02/22/17 06:50:18 AM PST","02/23/17 06:50:18 AM PST"
"1077","Goals! Congrats to these two!","https://www.facebook.com/Blacktivist-128371547505950/","United States","N/A","16 - 65+","English (UK)or English (US)","News Feed on desktop computers or News Feed on mobile
devices","Interests: Black nationalism, Pan-Africanism, Police
misconduct, African-American culture, African-American Civil Rights
Movement(1954-68), African-American history, Black Consciousness
Movement, Martin Luther King III, Stop Police Brutality or Black (Color)","N/A","0","0","0","02/07/17 07:18:27 AM PST","02/09/17 07:18:27 AM PST"
"2723","Smh","https://www.facebook.com/brownunitedfront/","- Living In: United States","N/A","18 - 65+","N/A","News Feed on desktop computers or News Feed on mobile
devices","Interests: Mexico. Latin hip hop. Chicano Movement,.
Hispanidad, Lowrider, Chicano rap or La Raza","N/A","57,784","6,764","600.00 RUB","03/09/17 03:11:13 AM PST","03/10/17 03:11:13 AM PST"
"3310","Repost from
Naomi Campbell. .. 25 years later. Seeing any difference?
Naomi Campbell. .. 25ans plus tard, voyez-vous une difference?","https://www.facebook.com/Hell_and_Back-1806743482876111/","- Living In: United States","N/A","18 - 65+","N/A","News Feed on desktop computers or News Feed on mobile
devices","Interests: Prison-industrial complex, Corrections
Corporation of America , American Correctional Association, Incarceration in
the United States, Prisoner, The Inmates, Children Of Inmates, Prison Wives
or School-to-prison pipeline","N/A","0","0","0","02/13/17 07:29:44 AM PST","02/14/17 07:29:44 AM PST"
"3339","Join the event, bring your friends, feel safe with us!
Don't miss the opportunity to train with our coach
You will enjoy it for sure.
It's free! Organized on a donation basis. Free Self-Defense class in Tampa, Fl","https://www.facebook.com/events/1546409575376750/","- Living In: United States: New York (+25 mi) New York","N/A","18 - 65+","English (UK) or English (US)","News Feed on desktop computers or News Feed on mobile
devices","Interests: Mixed martial arts, Martial arts, The Women's
Self Defense Institute, PERSONAL & HOME DEFENSE, Self-defense, Self-
defense (United States), Personal Defense, Right of self-defense, Self
Defense Family or Active Self Protection
And Must Also Match: Interests: Martin Luther King, Jr., Pan-Africanism,
Black Power, African American, Black history, Black Panther Party, African-
American culture, African-American Civil Rights Movement (1954-68), Black
History Month, African-American history, Angela Davis, Malcolm X or Black
(Color)","N/A","0","0","0","03/21/17 08:20:13 AM PDT","02/28/17 05:00:00 AM PST"
"3300","If you are Native, love and admire Native culture, join us! Native Americans
United","https://www.facebook.com/nativeprideunited/","- Living In: China","Exclude people who like Native Americans United","18 - 65+","English (UK)or English (US)","News Feed on desktop computers, News Feed on mobile
devices or Right column on desktop computers","Interests: Native American music, Native American Indian
Wisdom, Cherokee language, Indian Country Today Media Network,
Cherokee Nation or Native News Online","N/A","0","0","None","01/10/17 04:04:13 AM PST","N/A"
"1121","We do not want war or violence. We want egaulity and peace.","https://www.facebook.com/Blacktivist-128371547505950/","United States","N/A","16 - 65+","English (UK) or English (US)","News Feed on desktop computers or News Feed on mobile
devices","Interests: Pan-Africanism, African-American Civil Rights
Movement (1954-68), African-American history or Black (Color)","N/A","83,675","12,275","400.00 RUB","02/08/17 07:12:03 AM PST","02/09/17 07:12:03 AM PST"
"1109","Shop now! Select from our collection T-shirts for men and women.
https://www.facebook.com/pg/blacktivists/shop/?rid=128371547505950&rt=6
www.facebook.com facebook.com","https://www.facebook.com/blacktivists/shop/?rid=128371547505950&rt=6","United States","N/A","16 - 65+","English (UK)or English (US)","News Feed on desktop computers or News Feed on mobile
devices","Interests: Pan-Africanism, African-American Civil Rights
Movement(1954-68), African-American history or Black (Color)","N/A","5,520","102","500.00 RUB","01/24/17 12:32:44 AM PST","01/25/17 12:32:44 AM PST"
"3267","When 30 or 40 round mags no longer do and a 75 round drum is the only
way.
Repost from","https://www.facebook.com/ProtectBlackGunOwners/","- Living In: United States","N/A","18 - 65+","N/A","News Feed on desktop computers or News Feed on mobile
devices","Interests: 2nd Amendment, African-American Civil Rights
Movement ( 1954-68), Gun Owners of America, Concealed carry in the United
States, Gun Rights, Huey P. Newton or Malcolm X","N/A","1,406","219","200.00 RUB","02/01/17 05:25:30 AM PST","02/02/17 05:25:30 AM PST"
"3148","I agree that this Black heroine had an early start as a mother, yet,. she and her
son never gave up notwithstanding their condition. Be motivated and go out
and get what you want. You have the magic!
#PanAfricanism #BlackNationalism #BlackEmpowerment
#African Empowerment #AfricanAndProud #BlackAndProud #BlackPride
#BlackPower #BlackLivesMatter #Amerikkka #UnapologeticaIIyBlack
#UnapologeticallyAfrican #BlacklnAmerica #BlacklsBeautiful #KnowThySelf
#KnowledgeOfSelf #KnowledgeOfSelflsANationaIity
#EconomicEmpowerment #Integration Failed #WhiteLiesMatter #Education
#African Unification #AfricanUnity #BlackLove #JusticeOrElse #ProBlack
#Regrann #blackexcellence #goals #woke","https://www.facebook.com/Woke-Blacks-294234600956431/","- Living In: United States
Interests: Martin Luther King, Jr., African-American Civil Rights Movement
(1954-68), African-American history or Malcolm X","N/A","18 - 65+","N/A","News Feed on desktop computers or News Feed on mobile
devices","N/A","N/A","7,425","1,011","200.00 RUB","01/31/17 03:19:34 AM PST","02/01/17 03:19:34 AM PST"
"2592","Your mom knows what to do","https://www.facebook.com/brownunitedfront/","- Living In: United States","N/A","18 - 65+","N/A","News Feed on desktop computers or News Feed on mobile
devices","Interests: Hispanic and latino american culture, Mexico,
Mexican american culture, Hispanic culture, Latino culture, Latin hip hop,
Chicano. Chicano Movement, Hispanidad, Mexican Pride, Lowrider, Chicano
rap or La Raza","N/A","23,655","3,468","200.00 RUB","03/22/17 08:04:07 AM PDT","03/23/17 09:11:00 AM PDT"
